<?xml version="1.0" encoding="UTF-8"?>

<!ELEMENT blog (section)+>

<!ELEMENT section (title, article+)>

<!ELEMENT article (path, image, title, style*, script*)>

<!ELEMENT path (#PCDATA)>
<!ELEMENT image (#PCDATA)>
<!ELEMENT title (#PCDATA)>
<!ELEMENT style (#PCDATA)>
<!ELEMENT script (#PCDATA)>
